{
    "id": 25,
    "name": "omega-ruby",
    "names": [
        {
            "language": {
                "name": "ja",
                "url": "http://127.0.0.1:8000/api/v2/language/1/"
            },
            "name": "\u30aa\u30e1\u30ac\u30eb\u30d3\u30fc"
        },
        {
            "language": {
                "name": "fr",
                "url": "http://127.0.0.1:8000/api/v2/language/5/"
            },
            "name": "Rubis Om\u00e9ga"
        },
        {
            "language": {
                "name": "de",
                "url": "http://127.0.0.1:8000/api/v2/language/6/"
            },
            "name": "Omega Rubin"
        },
        {
            "language": {
                "name": "it",
                "url": "http://127.0.0.1:8000/api/v2/language/8/"
            },
            "name": "Rubino Omega"
        },
        {
            "language": {
                "name": "en",
                "url": "http://127.0.0.1:8000/api/v2/language/9/"
            },
            "name": "Omega Ruby"
        }
    ],
    "version_group": {
        "name": "omega-ruby-alpha-sapphire",
        "url": "http://127.0.0.1:8000/api/v2/version-group/16/"
    }
}
